{
  "version": 1,
  "name": "System overview",
  "canvas": {
    "width": 1280,
    "height": 800
  },
  "palette": {
    "name": "dynamic",
    "background": "#0a0f0f",
    "surface": "#131b1b",
    "surfaceRaised": "#192121",
    "text": "#dce8e7",
    "muted": "#a2adad",
    "primary": "#9bd0d1",
    "secondary": "#b0cccc",
    "outline": "#3f4a4a"
  },
  "widgets": [
    {
      "id": "clock",
      "type": "clock",
      "x": 946,
      "y": 40,
      "width": 270,
      "height": 80,
      "settings": {
        "label": "Local time",
        "time": "14:32",
        "date": "Tuesday, 6 October",
        "format": "24h",
        "showDate": true,
        "source": "clock"
      },
      "design": {
        "elements": {
          "time": {
            "align": "center"
          },
          "date": {
            "align": "center"
          }
        }
      }
    },
    {
      "id": "cpu",
      "type": "gauge",
      "x": 64,
      "y": 144,
      "width": 270,
      "height": 304,
      "settings": {
        "label": "CPU load",
        "value": 24,
        "min": 0,
        "max": 100,
        "unit": "%",
        "detail": "8 cores · 42 °C",
        "source": "cpu"
      }
    },
    {
      "id": "gpu",
      "type": "gauge",
      "x": 358,
      "y": 144,
      "width": 270,
      "height": 304,
      "settings": {
        "label": "GPU load",
        "value": 18,
        "min": 0,
        "max": 100,
        "unit": "%",
        "detail": "6.2 / 16 GB VRAM",
        "source": "gpu"
      }
    },
    {
      "id": "memory",
      "type": "gauge",
      "x": 652,
      "y": 144,
      "width": 270,
      "height": 304,
      "settings": {
        "label": "Memory",
        "value": 39,
        "min": 0,
        "max": 100,
        "unit": "%",
        "detail": "12.4 / 32 GB",
        "source": "memory"
      }
    },
    {
      "id": "disk",
      "type": "metric",
      "x": 64,
      "y": 472,
      "width": 270,
      "height": 224,
      "settings": {
        "label": "Disk",
        "value": "61",
        "unit": "%",
        "detail": "568.0 / 931 GB",
        "source": "disk"
      }
    },
    {
      "id": "network-down",
      "type": "metric",
      "x": 358,
      "y": 472,
      "width": 270,
      "height": 224,
      "settings": {
        "label": "Network down",
        "value": "3.2",
        "unit": "MB/s",
        "detail": "Download · wlan0",
        "source": "network-down"
      }
    },
    {
      "id": "network-up",
      "type": "metric",
      "x": 652,
      "y": 472,
      "width": 270,
      "height": 224,
      "settings": {
        "label": "Network up",
        "value": "184",
        "unit": "KB/s",
        "detail": "Upload · wlan0",
        "source": "network-up"
      }
    },
    {
      "id": "weather",
      "type": "weather",
      "x": 946,
      "y": 144,
      "width": 270,
      "height": 552,
      "settings": {
        "location": "Paris",
        "temperature": "19",
        "unit": "°C",
        "condition": "Partly cloudy",
        "high": "22",
        "low": "14",
        "source": "weather"
      }
    }
  ],
  "paletteMode": "live"
}
