{
  "version": 1,
  "name": "AI usage",
  "canvas": {
    "width": 1280,
    "height": 800
  },
  "palette": {
    "name": "dynamic",
    "background": "#0a0f0f",
    "surface": "#131b1b",
    "surfaceRaised": "#192121",
    "text": "#dce8e7",
    "muted": "#a2adad",
    "primary": "#9bd0d1",
    "secondary": "#b0cccc",
    "outline": "#3f4a4a"
  },
  "widgets": [
    {
      "id": "codex-weekly-bar",
      "type": "gauge",
      "x": 64,
      "y": 144,
      "width": 564,
      "height": 180,
      "settings": {
        "label": "Codex weekly limit",
        "value": 41,
        "min": 0,
        "max": 100,
        "unit": "%",
        "detail": "Demo \u00b7 cached provider allowance",
        "source": "codex-weekly",
        "style": "bar"
      }
    },
    {
      "id": "codex-tokens",
      "type": "metric",
      "x": 64,
      "y": 348,
      "width": 270,
      "height": 200,
      "settings": {
        "label": "Codex tokens",
        "value": "2.4",
        "unit": "M tokens",
        "detail": "Demo \u00b7 UTC today",
        "source": "codex-tokens"
      }
    },
    {
      "id": "codex-cost",
      "type": "metric",
      "x": 358,
      "y": 348,
      "width": 270,
      "height": 200,
      "settings": {
        "label": "Codex API cost",
        "value": "12.50",
        "unit": "USD",
        "detail": "Demo API estimate \u00b7 not a subscription bill",
        "source": "codex-cost"
      }
    },
    {
      "id": "codex-reset",
      "type": "metric",
      "x": 64,
      "y": 572,
      "width": 270,
      "height": 152,
      "settings": {
        "label": "Codex reset",
        "value": "2h 05m",
        "unit": "",
        "detail": "Demo reset countdown",
        "source": "codex-reset"
      }
    },
    {
      "id": "codex-models",
      "type": "metric",
      "x": 358,
      "y": 572,
      "width": 270,
      "height": 152,
      "settings": {
        "label": "Codex models",
        "value": "2",
        "unit": "models",
        "detail": "*Demo API estimates\ngpt-6.1-sol\t2.1M\t11.50\ngpt-6-luna\t300K\t1.00",
        "source": "codex-models"
      }
    },
    {
      "id": "claude-session-bar",
      "type": "gauge",
      "x": 652,
      "y": 144,
      "width": 270,
      "height": 180,
      "settings": {
        "label": "Claude 5-hour limit",
        "value": 68,
        "min": 0,
        "max": 100,
        "unit": "%",
        "detail": "Demo allowance",
        "source": "claude-session",
        "style": "bar"
      }
    },
    {
      "id": "claude-tokens",
      "type": "metric",
      "x": 652,
      "y": 348,
      "width": 270,
      "height": 200,
      "settings": {
        "label": "Claude tokens",
        "value": "840",
        "unit": "K tokens",
        "detail": "Demo \u00b7 UTC today",
        "source": "claude-tokens"
      }
    },
    {
      "id": "claude-cost",
      "type": "metric",
      "x": 946,
      "y": 348,
      "width": 270,
      "height": 200,
      "settings": {
        "label": "Claude API cost",
        "value": "8.40",
        "unit": "USD",
        "detail": "Demo API estimate \u00b7 not a subscription bill",
        "source": "claude-cost"
      }
    },
    {
      "id": "claude-reset",
      "type": "metric",
      "x": 652,
      "y": 572,
      "width": 270,
      "height": 152,
      "settings": {
        "label": "Claude reset",
        "value": "1h 12m",
        "unit": "",
        "detail": "Demo reset countdown",
        "source": "claude-reset"
      }
    },
    {
      "id": "claude-models",
      "type": "metric",
      "x": 946,
      "y": 572,
      "width": 270,
      "height": 152,
      "settings": {
        "label": "Claude models",
        "value": "2",
        "unit": "models",
        "detail": "*Demo API estimates\nclaude-opus\t740K\t7.20\nclaude-sonnet\t100K\t1.20",
        "source": "claude-models"
      }
    },
    {
      "id": "clock",
      "type": "clock",
      "x": 992,
      "y": 32,
      "width": 224,
      "height": 112,
      "settings": {
        "label": "Local time",
        "time": "14:32",
        "date": "Tuesday, 6 October",
        "format": "24h",
        "showDate": true,
        "source": "clock"
      }
    },
    {
      "id": "claude-weekly-bar",
      "type": "gauge",
      "x": 946,
      "y": 144,
      "width": 270,
      "height": 180,
      "settings": {
        "label": "Claude weekly limit",
        "value": 52,
        "min": 0,
        "max": 100,
        "unit": "%",
        "detail": "Demo allowance",
        "source": "claude-weekly",
        "style": "bar"
      }
    }
  ],
  "paletteMode": "live"
}
